{
  "schemaVersion": "1.0.0",
  "baselineDate": "2026-02-22",
  "hardwareProfile": {
    "label": "Mainstream 2021+ laptop baseline",
    "platformClass": "macOS M1 / Windows mid-tier Intel-AMD",
    "ramGb": 16,
    "notes": "Launch-blocking scorecard is evaluated on this class."
  },
  "providerMatrix": [
    { "providerType": "whisper", "modelId": "base.en", "launchBlocking": true },
    { "providerType": "parakeet", "modelId": "parakeet-tdt-ctc-110m", "launchBlocking": true },
    { "providerType": "canary", "modelId": "canary-whisper-large-v3-turbo", "launchBlocking": true },
    { "providerType": "distil_whisper", "modelId": "distil-large-v3.5", "launchBlocking": true },
    { "providerType": "moonshine", "modelId": "moonshine-base", "launchBlocking": true },
    { "providerType": "voxtral", "modelId": "voxtral-local", "launchBlocking": true },
    { "providerType": "openai_cloud", "modelId": "whisper-1", "launchBlocking": true },
    { "providerType": "elevenlabs_scribe", "modelId": "scribe_v1", "launchBlocking": true }
  ],
  "datasets": [
    {
      "id": "english-launch-blocking",
      "language": "en",
      "blocking": true,
      "items": [
        {
          "id": "dictation-en-001",
          "taskType": "dictation",
          "durationSeconds": 10,
          "audioPath": "scripts/fixtures/dictation-en-001.wav",
          "groundTruthPath": "docs/evals/ground-truth/dictation-en-001.txt"
        },
        {
          "id": "meeting-en-001",
          "taskType": "meeting",
          "durationSeconds": 180,
          "audioPath": "scripts/fixtures/meeting-en-001.wav",
          "groundTruthPath": "docs/evals/ground-truth/meeting-en-001.txt"
        }
      ]
    },
    {
      "id": "multilingual-smoke",
      "language": "mixed",
      "blocking": false,
      "items": [
        {
          "id": "meeting-multi-001",
          "taskType": "meeting",
          "durationSeconds": 120,
          "audioPath": "scripts/fixtures/meeting-multi-001.wav",
          "groundTruthPath": "docs/evals/ground-truth/meeting-multi-001.txt"
        }
      ]
    }
  ],
  "scorecardThresholds": {
    "crashFreeSessionsMin": 0.995,
    "providerSuccessRateMin": 0.99,
    "localRtfP95Max": 1.0,
    "cloudMedianLatencyMsMax": 4500,
    "dictationEndToEndLatencyP95MsMax": 1200,
    "meetingWerMax": 0.1,
    "dictationWerMax": 0.075,
    "diarizationDerMax": 0.18,
    "summaryFactualityMin": 0.9,
    "actionItemF1Min": 0.75
  },
  "competitorBaseline": {
    "sourceFile": "docs/evals/competitor-claims-2026-02-22.md",
    "relativeImprovement": 0.1,
    "rule": "For numeric competitor claims, Nautilus target is 10% better in the favorable direction."
  },
  "capabilityParity": {
    "superwhisper-fast-dictation": true,
    "granola-meeting-coverage": true
  }
}
